{
  "schema_version": "1.0",
  "request": "这个结果再深入一点，别只摆数字。",
  "task_understanding": "先把线索增长与成交转化分开，定位现稿遗漏的销售环节。不因为深入就追加无法获得的渠道细分或宣称原因已经证实。",
  "execution_status": "ready",
  "evidence": [
    {
      "id": "E1",
      "source": "input.request",
      "quote": "这个结果再深入一点，别只摆数字。"
    },
    {
      "id": "E2",
      "source": "input.md",
      "quote": "当前只有7月与8月线索量的柱状图，汇报用于决定下个月先改善哪个销售环节。"
    },
    {
      "id": "E3",
      "source": "input.md",
      "quote": "metrics.csv 是本案例的全模拟汇总数据，线索和成交口径保持一致，没有渠道明细和因果识别资料。"
    },
    {
      "id": "E4",
      "source": "metrics.csv",
      "quote": "2026-07,500,50"
    },
    {
      "id": "E5",
      "source": "metrics.csv",
      "quote": "2026-08,720,54"
    }
  ],
  "facts": [
    {
      "text": "原话要求，这个结果再深入一点，别只摆数字。",
      "evidence_ids": [
        "E1"
      ]
    },
    {
      "text": "当前只有7月与8月线索量的柱状图，汇报用于决定下个月先改善哪个销售环节。",
      "evidence_ids": [
        "E2"
      ]
    },
    {
      "text": "metrics.csv 是本案例的全模拟汇总数据，线索和成交口径保持一致，没有渠道明细和因果识别资料。",
      "evidence_ids": [
        "E3"
      ]
    },
    {
      "text": "按模拟数据计算，线索增长44.0%，成交增长8.0%。",
      "evidence_ids": [
        "E4",
        "E5"
      ]
    },
    {
      "text": "按模拟数据计算，线索到成交转化率由10.0%降到7.5%，变化为负2.5个百分点。",
      "evidence_ids": [
        "E4",
        "E5"
      ]
    }
  ],
  "interpretations": [
    {
      "meaning": "现有图表缺少转化口径，优先补漏斗比较。",
      "confidence": "medium",
      "evidence_ids": [
        "E2",
        "E3"
      ],
      "selected": true,
      "would_change": "若已有完整漏斗分析，则转向行动选择而非重复计算。"
    },
    {
      "meaning": "也可能需要解释因果原因，但现有汇总数据不够。",
      "confidence": "medium",
      "evidence_ids": [
        "E3"
      ],
      "selected": false,
      "would_change": "只有获得相应设计和资料后才能提高原因判断的强度。"
    }
  ],
  "assumptions": [
    {
      "id": "A1",
      "text": "先用现有两个月汇总做描述性核对，不提出未经授权的新数据收集。",
      "risk": "low",
      "reversible": true,
      "check_at": "收到首次反馈时复核。",
      "fallback": "只调整小稿，不扩大未确认范围。"
    }
  ],
  "question_policy": {
    "budget": 2,
    "exception_reason": ""
  },
  "clarifications": [],
  "deliverables": [
    {
      "id": "D1",
      "name": "漏斗变化与下一步检查简报",
      "format": "一页比较表加判断",
      "status": "proposed",
      "evidence_ids": [],
      "acceptance": [
        "同时展示线索量、成交量、转化率和比较基数。",
        "区分已观察到的变化与尚未证实的原因。",
        "明确下一步只核查最可能影响转化的环节，不泛列新分析。"
      ]
    }
  ],
  "tasks": [
    {
      "id": "T1",
      "action": "复核两个月的线索和成交口径。",
      "deliverable_id": "D1",
      "depends_on": [],
      "state": "ready",
      "acceptance": [
        "核对原始行后再比较比例。"
      ],
      "timebox": "建议先完成此步，不承诺未经确认的工时。"
    },
    {
      "id": "T2",
      "action": "补充成交转化率与变化。",
      "deliverable_id": "D1",
      "depends_on": [
        "T1"
      ],
      "state": "ready",
      "acceptance": [
        "转化率从10.0%到7.5%，下降2.5个百分点，不能写成下降2.5%。"
      ],
      "timebox": "建议先完成此步，不承诺未经确认的工时。"
    },
    {
      "id": "T3",
      "action": "把变化改写成需要优先核查的环节。",
      "deliverable_id": "D1",
      "depends_on": [
        "T2"
      ],
      "state": "ready",
      "acceptance": [
        "说明线索增加未带来同比例成交增加，不断言原因。"
      ],
      "timebox": "建议先完成此步，不承诺未经确认的工时。"
    }
  ],
  "approval_gates": [],
  "risks": [
    {
      "risk": "现有汇总无法证明转化下降的具体原因。",
      "impact": "可能错误归责给销售或渠道。",
      "mitigation": "只列需要验证的解释，不给确定归因。",
      "evidence_ids": [
        "E3"
      ]
    }
  ],
  "out_of_scope": [
    "不在没有渠道数据时编造渠道差异。",
    "不把转化下降直接解释为员工努力不足。",
    "不为显得深入而追加复杂模型。"
  ],
  "reply_draft": "我先补上线索到成交的转化比较。目前模拟数据里线索增长44.0%，成交只增长8.0%，转化率从10.0%降到7.5%。这说明只展示线索增长不够，我会把优先核查的环节和证据限制写清楚，暂不下原因结论。",
  "stop_condition": "已清楚指出现稿遗漏的转化环节及下一步核查方向即可，不在缺数据时无限细分。"
}
